{
  "schema_version": "1.0",
  "dataset_version": "decision-quality-v1",
  "source_corpus_sha256": "15471b591c005a51431b821feed4fa1761b4c08ab3b26fe69deb8f82bbc306f5",
  "review_method": "independent-project-review-v1",
  "reviewed_at": "2026-07-27",
  "projects": [
    {
      "project_id": "dd10abe4379e2e6760dcc145aa778e4d5229e94709aefbb1060c1b13d57d7b88",
      "repository_cluster": "dd10abe4379e2e6760dcc145aa778e4d5229e94709aefbb1060c1b13d57d7b88",
      "repository_root": "dd10abe4379e2e6760dcc145aa778e4d5229e94709aefbb1060c1b13d57d7b88",
      "language_context": "rust",
      "framework_context": "mixed-or-none",
      "fixture_provenance": "protected-public-corpus",
      "author": "upstream-public-project",
      "independent_reviewer": "independent-project-review-v1",
      "disposition": "accepted",
      "holdout": true,
      "reviewed_health_band": "great",
      "top_remediations": [
        "missing-msrv"
      ],
      "groups": [
        {
          "rule": "missing-msrv",
          "category": "cargo",
          "priority": "p2",
          "aggregation": "unique-rule",
          "occurrences": 1
        }
      ]
    },
    {
      "project_id": "0aeef1020e0ce8fd37cbb621e75ae135b4eb4a3290b6deef3ce99238b866aebc",
      "repository_cluster": "0aeef1020e0ce8fd37cbb621e75ae135b4eb4a3290b6deef3ce99238b866aebc",
      "repository_root": "0aeef1020e0ce8fd37cbb621e75ae135b4eb4a3290b6deef3ce99238b866aebc",
      "language_context": "rust",
      "framework_context": "mixed-or-none",
      "fixture_provenance": "protected-public-corpus",
      "author": "upstream-public-project",
      "independent_reviewer": "independent-project-review-v1",
      "disposition": "accepted",
      "holdout": false,
      "reviewed_health_band": "great",
      "top_remediations": [
        "missing-msrv",
        "msrv-outdated"
      ],
      "groups": [
        {
          "rule": "missing-msrv",
          "category": "cargo",
          "priority": "p2",
          "aggregation": "unique-rule",
          "occurrences": 8
        },
        {
          "rule": "msrv-outdated",
          "category": "cargo",
          "priority": "p2",
          "aggregation": "unique-rule",
          "occurrences": 1
        }
      ]
    },
    {
      "project_id": "c102b87c7bc7d0e214558251cbc34afb47347dca7cfd354819ecf0ea63e4baae",
      "repository_cluster": "c102b87c7bc7d0e214558251cbc34afb47347dca7cfd354819ecf0ea63e4baae",
      "repository_root": "c102b87c7bc7d0e214558251cbc34afb47347dca7cfd354819ecf0ea63e4baae",
      "language_context": "rust",
      "framework_context": "mixed-or-none",
      "fixture_provenance": "protected-public-corpus",
      "author": "upstream-public-project",
      "independent_reviewer": "independent-project-review-v1",
      "disposition": "accepted",
      "holdout": false,
      "reviewed_health_band": "great",
      "top_remediations": [
        "msrv-outdated"
      ],
      "groups": [
        {
          "rule": "msrv-outdated",
          "category": "cargo",
          "priority": "p2",
          "aggregation": "unique-rule",
          "occurrences": 1
        }
      ]
    },
    {
      "project_id": "22787a9c15fa5c8fabf5546d70a83a0ae44b85e3a7c02a42b602ff47f7cf0942",
      "repository_cluster": "22787a9c15fa5c8fabf5546d70a83a0ae44b85e3a7c02a42b602ff47f7cf0942",
      "repository_root": "22787a9c15fa5c8fabf5546d70a83a0ae44b85e3a7c02a42b602ff47f7cf0942",
      "language_context": "rust",
      "framework_context": "mixed-or-none",
      "fixture_provenance": "protected-public-corpus",
      "author": "upstream-public-project",
      "independent_reviewer": "independent-project-review-v1",
      "disposition": "accepted",
      "holdout": false,
      "reviewed_health_band": "great",
      "top_remediations": [
        "missing-msrv"
      ],
      "groups": [
        {
          "rule": "missing-msrv",
          "category": "cargo",
          "priority": "p2",
          "aggregation": "unique-rule",
          "occurrences": 1
        }
      ]
    },
    {
      "project_id": "f4b049bbedddd750dcd7fc55dcb24fe9540a610c735e274da30d6e74eb1865ae",
      "repository_cluster": "f4b049bbedddd750dcd7fc55dcb24fe9540a610c735e274da30d6e74eb1865ae",
      "repository_root": "f4b049bbedddd750dcd7fc55dcb24fe9540a610c735e274da30d6e74eb1865ae",
      "language_context": "rust",
      "framework_context": "mixed-or-none",
      "fixture_provenance": "protected-public-corpus",
      "author": "upstream-public-project",
      "independent_reviewer": "independent-project-review-v1",
      "disposition": "accepted",
      "holdout": false,
      "reviewed_health_band": "great",
      "top_remediations": [
        "missing-msrv"
      ],
      "groups": [
        {
          "rule": "missing-msrv",
          "category": "cargo",
          "priority": "p2",
          "aggregation": "unique-rule",
          "occurrences": 3
        }
      ]
    },
    {
      "project_id": "99a8a4b60abe643af2c3879b8e142139808b1b4531a160fbfeacfe60066aed46",
      "repository_cluster": "99a8a4b60abe643af2c3879b8e142139808b1b4531a160fbfeacfe60066aed46",
      "repository_root": "99a8a4b60abe643af2c3879b8e142139808b1b4531a160fbfeacfe60066aed46",
      "language_context": "rust",
      "framework_context": "mixed-or-none",
      "fixture_provenance": "protected-public-corpus",
      "author": "upstream-public-project",
      "independent_reviewer": "independent-project-review-v1",
      "disposition": "accepted",
      "holdout": true,
      "reviewed_health_band": "great",
      "top_remediations": [
        "missing-msrv"
      ],
      "groups": [
        {
          "rule": "missing-msrv",
          "category": "cargo",
          "priority": "p2",
          "aggregation": "unique-rule",
          "occurrences": 38
        }
      ]
    },
    {
      "project_id": "765ae0f1b66fdb3c174bd94bf69119186d981e0c8e8d91ed4305174de81d6831",
      "repository_cluster": "765ae0f1b66fdb3c174bd94bf69119186d981e0c8e8d91ed4305174de81d6831",
      "repository_root": "765ae0f1b66fdb3c174bd94bf69119186d981e0c8e8d91ed4305174de81d6831",
      "language_context": "rust",
      "framework_context": "mixed-or-none",
      "fixture_provenance": "protected-public-corpus",
      "author": "upstream-public-project",
      "independent_reviewer": "independent-project-review-v1",
      "disposition": "accepted",
      "holdout": false,
      "reviewed_health_band": "great",
      "top_remediations": [],
      "groups": []
    },
    {
      "project_id": "2f2849518b8b6797568cc079bc046a80dc69a6d53425afebba984022709ed5f6",
      "repository_cluster": "2f2849518b8b6797568cc079bc046a80dc69a6d53425afebba984022709ed5f6",
      "repository_root": "2f2849518b8b6797568cc079bc046a80dc69a6d53425afebba984022709ed5f6",
      "language_context": "rust",
      "framework_context": "mixed-or-none",
      "fixture_provenance": "protected-public-corpus",
      "author": "upstream-public-project",
      "independent_reviewer": "independent-project-review-v1",
      "disposition": "accepted",
      "holdout": false,
      "reviewed_health_band": "great",
      "top_remediations": [],
      "groups": []
    },
    {
      "project_id": "d7b0fbe59cef983569986c4df78d2c5f33258d64ea1e9b16aa8ae8e33c808e08",
      "repository_cluster": "d7b0fbe59cef983569986c4df78d2c5f33258d64ea1e9b16aa8ae8e33c808e08",
      "repository_root": "d7b0fbe59cef983569986c4df78d2c5f33258d64ea1e9b16aa8ae8e33c808e08",
      "language_context": "rust",
      "framework_context": "mixed-or-none",
      "fixture_provenance": "protected-public-corpus",
      "author": "upstream-public-project",
      "independent_reviewer": "independent-project-review-v1",
      "disposition": "accepted",
      "holdout": false,
      "reviewed_health_band": "great",
      "top_remediations": [
        "missing-msrv"
      ],
      "groups": [
        {
          "rule": "missing-msrv",
          "category": "cargo",
          "priority": "p2",
          "aggregation": "unique-rule",
          "occurrences": 5
        }
      ]
    },
    {
      "project_id": "703770ca908bd766d7d8df405894cf2e50971cc991e1fe10d9ac0721037263ff",
      "repository_cluster": "703770ca908bd766d7d8df405894cf2e50971cc991e1fe10d9ac0721037263ff",
      "repository_root": "703770ca908bd766d7d8df405894cf2e50971cc991e1fe10d9ac0721037263ff",
      "language_context": "rust",
      "framework_context": "mixed-or-none",
      "fixture_provenance": "protected-public-corpus",
      "author": "upstream-public-project",
      "independent_reviewer": "independent-project-review-v1",
      "disposition": "accepted",
      "holdout": false,
      "reviewed_health_band": "great",
      "top_remediations": [],
      "groups": []
    },
    {
      "project_id": "2330b4437435a4b1379da1c605533caf4763108d84859297042d879b1fd25b2e",
      "repository_cluster": "2330b4437435a4b1379da1c605533caf4763108d84859297042d879b1fd25b2e",
      "repository_root": "2330b4437435a4b1379da1c605533caf4763108d84859297042d879b1fd25b2e",
      "language_context": "rust",
      "framework_context": "mixed-or-none",
      "fixture_provenance": "protected-public-corpus",
      "author": "upstream-public-project",
      "independent_reviewer": "independent-project-review-v1",
      "disposition": "accepted",
      "holdout": true,
      "reviewed_health_band": "great",
      "top_remediations": [],
      "groups": []
    },
    {
      "project_id": "56e3e31d9522eb3914f7315701cdf6c0d61704b466b4fe6f5db39c53fbc99d56",
      "repository_cluster": "56e3e31d9522eb3914f7315701cdf6c0d61704b466b4fe6f5db39c53fbc99d56",
      "repository_root": "56e3e31d9522eb3914f7315701cdf6c0d61704b466b4fe6f5db39c53fbc99d56",
      "language_context": "rust",
      "framework_context": "mixed-or-none",
      "fixture_provenance": "protected-public-corpus",
      "author": "upstream-public-project",
      "independent_reviewer": "independent-project-review-v1",
      "disposition": "accepted",
      "holdout": false,